<!DOCTYPE walkmod PUBLIC "-//WALKMOD//DTD"  "http://www.walkmod.com/dtd/walkmod-1.0.dtd" >
<walkmod>
	<plugins>
		<plugin groupId="org.walkmod" artifactId="walkmod-maven-plugin"
			version="[1.1.1,2.0)" />
		<plugin groupId="org.walkmod" artifactId="walkmod-dead-code-cleaner-plugin"
			version="[1.0.0, 2.0)" />
	</plugins>
	<conf-providers>
		<conf-provider type="walkmod:commons:maven"></conf-provider>
	</conf-providers>
	<chain name="main-chain">
		<transformation type="walkmod:commons:unused-declarations-cleaner" />
	</chain>
</walkmod>